{
  "$schema": "../level.schema.json",
  "id": "level-046",
  "name": "Nível 46",
  "colors": {
    "teal": { "color": "#0f766e", "pattern": "checker", "label": "verde-petróleo" },
    "pink": { "color": "#f9a8d4", "pattern": "dots", "label": "rosa" },
    "cyan": { "color": "#67e8f9", "pattern": "grid", "label": "ciano" },
    "brown": { "color": "#a2692f", "pattern": "wood", "label": "marrom" },
    "blue": { "color": "#3b82f6", "pattern": "stripes", "label": "azul" },
    "red": { "color": "#ef4444", "pattern": "solid", "label": "vermelho" },
    "orange": { "color": "#f97316", "pattern": "vstripes", "label": "laranja" },
    "yellow": { "color": "#facc15", "pattern": "diagonal", "label": "amarelo" },
    "violet": { "color": "#a855f7", "pattern": "checker", "label": "roxo" },
    "green": { "color": "#22c55e", "pattern": "dots", "label": "verde" }
  },
  "tubes": [
    { "capacity": 6, "contents": ["orange", "red", "cyan"] },
    { "capacity": 6, "contents": ["cyan", "orange", "pink", "red", "orange", "teal"] },
    { "capacity": 7, "contents": ["red", "violet", "orange", "green", "pink", "green"] },
    { "capacity": 7, "contents": ["pink", "teal", "brown", "violet", "red", "yellow", "brown"] },
    { "capacity": 4, "contents": ["violet", "blue", "green", "brown"] },
    { "capacity": 4, "contents": ["brown", "violet", "brown", "green"] },
    { "capacity": 3, "contents": ["red", "cyan", "violet"] },
    { "capacity": 5, "contents": ["red", "yellow", "brown", "blue", "teal"] },
    { "capacity": 3, "contents": ["yellow", "violet", "teal"] },
    { "capacity": 3, "contents": [] },
    { "capacity": 5, "contents": ["yellow", "teal", "violet", "blue", "orange"] },
    { "capacity": 4, "contents": ["cyan", "red", "yellow", "orange"] }
  ],
  "layout": {
    "groups": [
      [
        [0, 1, 2, 3]
      ],
      [
        [4, 5, 6, 7],
        [8, 9, 10, 11]
      ]
    ]
  }
}
