{
  "$schema": "../level.schema.json",
  "id": "level-095",
  "name": "Nível 95",
  "colors": {
    "violet": { "color": "#a855f7", "pattern": "checker", "label": "roxo" },
    "orange": { "color": "#f97316", "pattern": "vstripes", "label": "laranja" },
    "cyan": { "color": "#67e8f9", "pattern": "grid", "label": "ciano" },
    "green": { "color": "#22c55e", "pattern": "dots", "label": "verde" },
    "brown": { "color": "#a2692f", "pattern": "wood", "label": "marrom" },
    "blue": { "color": "#3b82f6", "pattern": "stripes", "label": "azul" },
    "red": { "color": "#ef4444", "pattern": "solid", "label": "vermelho" },
    "magenta": { "color": "#ea3fe0", "pattern": "diagonal", "label": "magenta" },
    "pink": { "color": "#f9a8d4", "pattern": "dots", "label": "rosa" },
    "teal": { "color": "#0f766e", "pattern": "checker", "label": "verde-petróleo" },
    "yellow": { "color": "#facc15", "pattern": "diagonal", "label": "amarelo" },
    "lime": { "color": "#a3e635", "pattern": "vstripes", "label": "verde-limão" }
  },
  "tubes": [
    { "capacity": 5, "contents": ["lime", "blue", "blue", "yellow", "violet"] },
    { "capacity": 5, "contents": ["brown", "green", "teal", "cyan", "yellow"] },
    { "capacity": 5, "contents": ["green", "brown", "orange", "orange", "green"] },
    { "capacity": 5, "contents": ["blue", "orange", "red", "brown", "lime"] },
    { "capacity": 5, "contents": ["cyan", "pink", "magenta", "teal", "cyan"] },
    { "capacity": 5, "contents": ["yellow", "teal", "brown", "orange", "violet"] },
    { "capacity": 5, "contents": ["green", "pink", "magenta", "magenta", "violet"] },
    { "capacity": 5, "contents": ["blue", "teal", "blue", "lime", "violet"] },
    { "capacity": 5, "contents": ["magenta", "yellow", "lime", "pink", "red"] },
    { "capacity": 5, "contents": ["cyan", "brown", "lime", "pink", "cyan"] },
    { "capacity": 5, "contents": ["pink", "yellow", "orange", "red", "red"] },
    { "capacity": 5, "contents": ["magenta", "green", "teal", "violet", "red"] },
    { "capacity": 5, "contents": [] },
    { "capacity": 5, "contents": [] }
  ],
  "layout": {
    "groups": [
      [
        [0, 1, 2, 3, 4, 5, 6],
        [7, 8, 9, 10, 11, 12, 13]
      ]
    ]
  }
}
