{
  "$schema": "../level.schema.json",
  "id": "level-027",
  "name": "Nível 27",
  "colors": {
    "orange": { "color": "#f97316", "pattern": "vstripes", "label": "laranja" },
    "violet": { "color": "#a855f7", "pattern": "checker", "label": "roxo" },
    "yellow": { "color": "#facc15", "pattern": "diagonal", "label": "amarelo" },
    "blue": { "color": "#3b82f6", "pattern": "stripes", "label": "azul" },
    "pink": { "color": "#f9a8d4", "pattern": "dots", "label": "rosa" },
    "cyan": { "color": "#67e8f9", "pattern": "grid", "label": "ciano" },
    "teal": { "color": "#0f766e", "pattern": "checker", "label": "verde-petróleo" }
  },
  "tubes": [
    { "capacity": 4, "contents": ["pink", "orange", "blue", "pink"] },
    { "capacity": 4, "contents": ["orange", "orange", "yellow", "teal"] },
    { "capacity": 4, "contents": ["violet", "pink", "cyan", "violet"] },
    { "capacity": 4, "contents": ["cyan", "blue", "orange", "cyan"] },
    { "capacity": 4, "contents": ["teal", "cyan", "teal", "yellow"] },
    { "capacity": 4, "contents": ["violet", "yellow", "blue", "blue"] },
    { "capacity": 4, "contents": ["violet", "teal", "pink", "yellow"] },
    { "capacity": 4, "contents": [] },
    { "capacity": 4, "contents": [] }
  ],
  "layout": {
    "groups": [
      [
        [0, 1, 2, 3, 4],
        [5, 6, 7, 8]
      ]
    ]
  }
}
