{
  "$schema": "../level.schema.json",
  "id": "level-056",
  "name": "Nível 56",
  "colors": {
    "orange": { "color": "#f97316", "pattern": "vstripes", "label": "laranja" },
    "brown": { "color": "#a2692f", "pattern": "wood", "label": "marrom" },
    "red": { "color": "#ef4444", "pattern": "solid", "label": "vermelho" },
    "cyan": { "color": "#67e8f9", "pattern": "grid", "label": "ciano" },
    "green": { "color": "#22c55e", "pattern": "dots", "label": "verde" },
    "teal": { "color": "#0f766e", "pattern": "checker", "label": "verde-petróleo" },
    "pink": { "color": "#f9a8d4", "pattern": "dots", "label": "rosa" },
    "yellow": { "color": "#facc15", "pattern": "diagonal", "label": "amarelo" },
    "lime": { "color": "#a3e635", "pattern": "vstripes", "label": "verde-limão" },
    "magenta": { "color": "#ea3fe0", "pattern": "diagonal", "label": "magenta" }
  },
  "tubes": [
    { "capacity": 4, "contents": ["pink", "magenta", "cyan", "lime"] },
    { "capacity": 4, "contents": ["red", "pink", "teal", "brown"] },
    { "capacity": 4, "contents": ["red", "pink", "red", "yellow"] },
    { "capacity": 4, "contents": ["cyan", "lime", "yellow", "orange"] },
    { "capacity": 4, "contents": ["lime", "orange", "cyan", "magenta"] },
    { "capacity": 4, "contents": ["magenta", "cyan", "teal", "green"] },
    { "capacity": 4, "contents": ["red", "magenta", "orange", "teal"] },
    { "capacity": 4, "contents": ["brown", "green", "brown", "yellow"] },
    { "capacity": 4, "contents": ["yellow", "teal", "orange", "green"] },
    { "capacity": 4, "contents": ["brown", "green", "pink", "lime"] },
    { "capacity": 4, "contents": [] },
    { "capacity": 4, "contents": [] }
  ],
  "layout": {
    "groups": [
      [
        [0, 1, 2, 3, 4, 5],
        [6, 7, 8, 9, 10, 11]
      ]
    ]
  }
}
