{
  "$schema": "../level.schema.json",
  "id": "level-089",
  "name": "Nível 89",
  "colors": {
    "lime": { "color": "#a3e635", "pattern": "vstripes", "label": "verde-limão" },
    "violet": { "color": "#a855f7", "pattern": "checker", "label": "roxo" },
    "orange": { "color": "#f97316", "pattern": "vstripes", "label": "laranja" },
    "brown": { "color": "#a2692f", "pattern": "wood", "label": "marrom" },
    "pink": { "color": "#f9a8d4", "pattern": "dots", "label": "rosa" },
    "cyan": { "color": "#67e8f9", "pattern": "grid", "label": "ciano" },
    "green": { "color": "#22c55e", "pattern": "dots", "label": "verde" },
    "blue": { "color": "#3b82f6", "pattern": "stripes", "label": "azul" },
    "yellow": { "color": "#facc15", "pattern": "diagonal", "label": "amarelo" },
    "teal": { "color": "#0f766e", "pattern": "checker", "label": "verde-petróleo" },
    "red": { "color": "#ef4444", "pattern": "solid", "label": "vermelho" },
    "magenta": { "color": "#ea3fe0", "pattern": "diagonal", "label": "magenta" }
  },
  "tubes": [
    { "capacity": 5, "contents": ["magenta", "green", "green", "red", "pink"] },
    { "capacity": 5, "contents": ["lime", "orange", "brown", "magenta", "brown"] },
    { "capacity": 5, "contents": ["violet", "cyan", "yellow", "yellow", "green"] },
    { "capacity": 5, "contents": ["magenta", "lime", "brown", "orange", "yellow"] },
    { "capacity": 5, "contents": ["red", "blue", "teal", "pink", "teal"] },
    { "capacity": 5, "contents": ["pink", "teal", "blue", "orange", "cyan"] },
    { "capacity": 5, "contents": ["violet", "green", "magenta", "cyan", "blue"] },
    { "capacity": 5, "contents": ["lime", "green", "teal", "red", "blue"] },
    { "capacity": 5, "contents": ["blue", "pink", "violet", "violet", "yellow"] },
    { "capacity": 5, "contents": ["cyan", "pink", "violet", "brown", "red"] },
    { "capacity": 5, "contents": ["magenta", "orange", "red", "lime", "orange"] },
    { "capacity": 5, "contents": ["lime", "cyan", "yellow", "teal", "brown"] },
    { "capacity": 5, "contents": [] },
    { "capacity": 5, "contents": [] }
  ],
  "layout": {
    "groups": [
      [
        [0, 1, 2, 3, 4, 5, 6],
        [7, 8, 9, 10, 11, 12, 13]
      ]
    ]
  }
}
