{
  "$schema": "../level.schema.json",
  "id": "level-096",
  "name": "Nível 96",
  "colors": {
    "cyan": { "color": "#67e8f9", "pattern": "grid", "label": "ciano" },
    "yellow": { "color": "#facc15", "pattern": "diagonal", "label": "amarelo" },
    "magenta": { "color": "#ea3fe0", "pattern": "diagonal", "label": "magenta" },
    "blue": { "color": "#3b82f6", "pattern": "stripes", "label": "azul" },
    "green": { "color": "#22c55e", "pattern": "dots", "label": "verde" },
    "violet": { "color": "#a855f7", "pattern": "checker", "label": "roxo" },
    "red": { "color": "#ef4444", "pattern": "solid", "label": "vermelho" },
    "lime": { "color": "#a3e635", "pattern": "vstripes", "label": "verde-limão" },
    "pink": { "color": "#f9a8d4", "pattern": "dots", "label": "rosa" },
    "brown": { "color": "#a2692f", "pattern": "wood", "label": "marrom" },
    "teal": { "color": "#0f766e", "pattern": "checker", "label": "verde-petróleo" },
    "orange": { "color": "#f97316", "pattern": "vstripes", "label": "laranja" }
  },
  "tubes": [
    { "capacity": 5, "contents": ["pink", "cyan", "blue", "red", "teal"] },
    { "capacity": 5, "contents": ["pink", "green", "yellow", "green", "orange"] },
    { "capacity": 5, "contents": ["violet", "pink", "lime", "brown", "green"] },
    { "capacity": 5, "contents": ["violet", "violet", "orange", "magenta", "teal"] },
    { "capacity": 5, "contents": ["violet", "yellow", "yellow", "blue", "brown"] },
    { "capacity": 5, "contents": ["lime", "pink", "green", "cyan", "brown"] },
    { "capacity": 5, "contents": ["yellow", "teal", "blue", "violet", "blue"] },
    { "capacity": 5, "contents": ["red", "blue", "red", "cyan", "magenta"] },
    { "capacity": 5, "contents": ["orange", "red", "magenta", "lime", "orange"] },
    { "capacity": 5, "contents": ["cyan", "orange", "magenta", "brown", "lime"] },
    { "capacity": 5, "contents": ["lime", "green", "pink", "brown", "teal"] },
    { "capacity": 5, "contents": ["cyan", "magenta", "yellow", "teal", "red"] },
    { "capacity": 5, "contents": [] },
    { "capacity": 5, "contents": [] }
  ],
  "layout": {
    "groups": [
      [
        [0, 1, 2, 3, 4, 5, 6],
        [7, 8, 9, 10, 11, 12, 13]
      ]
    ]
  }
}
