{
  "$schema": "../level.schema.json",
  "id": "level-057",
  "name": "Nível 57",
  "colors": {
    "pink": { "color": "#f9a8d4", "pattern": "dots", "label": "rosa" },
    "brown": { "color": "#a2692f", "pattern": "wood", "label": "marrom" },
    "cyan": { "color": "#67e8f9", "pattern": "grid", "label": "ciano" },
    "yellow": { "color": "#facc15", "pattern": "diagonal", "label": "amarelo" },
    "orange": { "color": "#f97316", "pattern": "vstripes", "label": "laranja" },
    "violet": { "color": "#a855f7", "pattern": "checker", "label": "roxo" },
    "blue": { "color": "#3b82f6", "pattern": "stripes", "label": "azul" },
    "lime": { "color": "#a3e635", "pattern": "vstripes", "label": "verde-limão" },
    "green": { "color": "#22c55e", "pattern": "dots", "label": "verde" },
    "magenta": { "color": "#ea3fe0", "pattern": "diagonal", "label": "magenta" }
  },
  "tubes": [
    { "capacity": 5, "contents": ["blue", "lime", "violet", "yellow", "cyan"] },
    { "capacity": 5, "contents": ["brown", "blue", "brown", "blue", "violet"] },
    { "capacity": 5, "contents": ["green", "yellow", "green", "pink", "lime"] },
    { "capacity": 5, "contents": ["brown", "blue", "cyan", "orange", "lime"] },
    { "capacity": 5, "contents": ["cyan", "pink", "pink", "orange", "yellow"] },
    { "capacity": 5, "contents": ["lime", "lime", "violet", "magenta", "pink"] },
    { "capacity": 5, "contents": ["blue", "violet", "magenta", "yellow", "orange"] },
    { "capacity": 5, "contents": ["yellow", "green", "brown", "orange", "green"] },
    { "capacity": 5, "contents": ["brown", "cyan", "magenta", "green", "orange"] },
    { "capacity": 5, "contents": ["cyan", "magenta", "pink", "violet", "magenta"] },
    { "capacity": 5, "contents": [] },
    { "capacity": 5, "contents": [] }
  ],
  "layout": {
    "groups": [
      [
        [0, 1, 2, 3, 4, 5],
        [6, 7, 8, 9, 10, 11]
      ]
    ]
  }
}
