{
  "$schema": "../level.schema.json",
  "id": "level-053",
  "name": "Nível 53",
  "colors": {
    "red": { "color": "#ef4444", "pattern": "solid", "label": "vermelho" },
    "cyan": { "color": "#67e8f9", "pattern": "grid", "label": "ciano" },
    "teal": { "color": "#0f766e", "pattern": "checker", "label": "verde-petróleo" },
    "lime": { "color": "#a3e635", "pattern": "vstripes", "label": "verde-limão" },
    "green": { "color": "#22c55e", "pattern": "dots", "label": "verde" },
    "orange": { "color": "#f97316", "pattern": "vstripes", "label": "laranja" },
    "blue": { "color": "#3b82f6", "pattern": "stripes", "label": "azul" },
    "brown": { "color": "#a2692f", "pattern": "wood", "label": "marrom" },
    "yellow": { "color": "#facc15", "pattern": "diagonal", "label": "amarelo" },
    "pink": { "color": "#f9a8d4", "pattern": "dots", "label": "rosa" }
  },
  "tubes": [
    { "capacity": 5, "contents": ["cyan", "red", "pink", "orange", "brown"] },
    { "capacity": 5, "contents": ["red", "lime", "yellow", "teal", "cyan"] },
    { "capacity": 5, "contents": ["orange", "blue", "brown", "lime", "teal"] },
    { "capacity": 5, "contents": ["red", "pink", "teal", "red", "lime"] },
    { "capacity": 5, "contents": ["blue", "brown", "teal", "blue", "green"] },
    { "capacity": 5, "contents": ["green", "brown", "cyan", "pink", "cyan"] },
    { "capacity": 5, "contents": ["brown", "green", "green", "blue", "yellow"] },
    { "capacity": 5, "contents": ["orange", "pink", "lime", "yellow", "orange"] },
    { "capacity": 5, "contents": ["green", "blue", "red", "yellow", "cyan"] },
    { "capacity": 5, "contents": ["lime", "orange", "teal", "pink", "yellow"] },
    { "capacity": 5, "contents": [] },
    { "capacity": 5, "contents": [] }
  ],
  "layout": {
    "groups": [
      [
        [0, 1, 2, 3, 4, 5],
        [6, 7, 8, 9, 10, 11]
      ]
    ]
  }
}
