{
  "$schema": "../level.schema.json",
  "id": "level-017",
  "name": "Nível 17",
  "colors": {
    "cyan": { "color": "#67e8f9", "pattern": "grid", "label": "ciano" },
    "pink": { "color": "#f9a8d4", "pattern": "dots", "label": "rosa" },
    "blue": { "color": "#3b82f6", "pattern": "stripes", "label": "azul" },
    "brown": { "color": "#a2692f", "pattern": "wood", "label": "marrom" },
    "yellow": { "color": "#facc15", "pattern": "diagonal", "label": "amarelo" },
    "violet": { "color": "#a855f7", "pattern": "checker", "label": "roxo" }
  },
  "tubes": [
    { "capacity": 4, "contents": ["brown", "brown", "blue", "violet"] },
    { "capacity": 4, "contents": ["cyan", "cyan", "pink", "pink"] },
    { "capacity": 4, "contents": ["yellow", "pink", "brown", "violet"] },
    { "capacity": 4, "contents": ["cyan", "brown", "blue", "yellow"] },
    { "capacity": 4, "contents": ["cyan", "blue", "violet", "blue"] },
    { "capacity": 4, "contents": ["pink", "violet", "yellow", "yellow"] },
    { "capacity": 4, "contents": [] },
    { "capacity": 4, "contents": [] }
  ],
  "layout": {
    "groups": [
      [
        [0, 1, 2, 3],
        [4, 5, 6, 7]
      ]
    ]
  }
}
