{
  "$schema": "../level.schema.json",
  "id": "level-034",
  "name": "Nível 34",
  "colors": {
    "pink": { "color": "#f9a8d4", "pattern": "dots", "label": "rosa" },
    "blue": { "color": "#3b82f6", "pattern": "stripes", "label": "azul" },
    "orange": { "color": "#f97316", "pattern": "vstripes", "label": "laranja" },
    "red": { "color": "#ef4444", "pattern": "solid", "label": "vermelho" },
    "brown": { "color": "#a2692f", "pattern": "wood", "label": "marrom" },
    "violet": { "color": "#a855f7", "pattern": "checker", "label": "roxo" },
    "green": { "color": "#22c55e", "pattern": "dots", "label": "verde" },
    "yellow": { "color": "#facc15", "pattern": "diagonal", "label": "amarelo" }
  },
  "tubes": [
    { "capacity": 3, "contents": ["brown", "yellow", "blue"] },
    { "capacity": 4, "contents": ["pink", "yellow", "yellow"] },
    { "capacity": 5, "contents": [] },
    { "capacity": 4, "contents": ["yellow", "blue", "pink", "green"] },
    { "capacity": 4, "contents": ["blue", "yellow", "pink", "red"] },
    { "capacity": 3, "contents": ["green", "blue", "green"] },
    { "capacity": 5, "contents": ["red", "green", "violet", "orange", "brown"] },
    { "capacity": 4, "contents": ["red", "blue"] },
    { "capacity": 5, "contents": ["violet", "pink", "green", "brown", "orange"] },
    { "capacity": 5, "contents": ["orange", "violet", "brown", "brown", "violet"] }
  ],
  "layout": {
    "groups": [
      [
        [0, 1, 2, 3, 4],
        [5, 6, 7, 8, 9]
      ]
    ]
  }
}
