{
  "$schema": "../level.schema.json",
  "id": "level-042",
  "name": "Nível 42",
  "colors": {
    "pink": { "color": "#f9a8d4", "pattern": "dots", "label": "rosa" },
    "yellow": { "color": "#facc15", "pattern": "diagonal", "label": "amarelo" },
    "green": { "color": "#22c55e", "pattern": "dots", "label": "verde" },
    "violet": { "color": "#a855f7", "pattern": "checker", "label": "roxo" },
    "red": { "color": "#ef4444", "pattern": "solid", "label": "vermelho" },
    "orange": { "color": "#f97316", "pattern": "vstripes", "label": "laranja" },
    "cyan": { "color": "#67e8f9", "pattern": "grid", "label": "ciano" },
    "teal": { "color": "#0f766e", "pattern": "checker", "label": "verde-petróleo" },
    "blue": { "color": "#3b82f6", "pattern": "stripes", "label": "azul" }
  },
  "tubes": [
    { "capacity": 4, "contents": ["violet", "yellow", "red", "cyan"] },
    { "capacity": 4, "contents": ["blue", "red", "orange", "green"] },
    { "capacity": 4, "contents": ["green", "orange", "pink", "cyan"] },
    { "capacity": 4, "contents": ["teal", "cyan", "teal", "red"] },
    { "capacity": 4, "contents": ["pink", "teal", "violet", "green"] },
    { "capacity": 4, "contents": ["green", "violet", "yellow", "orange"] },
    { "capacity": 4, "contents": ["orange", "teal", "pink", "yellow"] },
    { "capacity": 4, "contents": ["yellow", "blue", "violet", "cyan"] },
    { "capacity": 4, "contents": ["pink", "blue", "red", "blue"] },
    { "capacity": 4, "contents": [] },
    { "capacity": 4, "contents": [] }
  ],
  "layout": {
    "groups": [
      [
        [0, 1, 2, 3, 4, 5],
        [6, 7, 8, 9, 10]
      ]
    ]
  }
}
